{
  "id": "ddev-php83",
  "name": "DDEV PHP 8.3 / MariaDB 10.11",
  "destination": "Managed DDEV images \u00b7 PHP 8.3 / MariaDB 10.11",
  "php": {
    "version": "8.3",
    "supportedPattern": "^8\\.[123]\\."
  },
  "database": {
    "type": "MariaDB",
    "version": "10.11",
    "supportedTypes": [
      "MariaDB",
      "MySQL"
    ],
    "supportedPattern": "^(?:10\\.(?:[3-9]|10|11)|11\\.|8\\.[0-9]+)"
  },
  "images": {
    "cli": "ddev/ddev-webserver:v1.23.0",
    "db": "ddev/ddev-dbserver-mariadb-10.11:v1.23.0",
    "web": "ddev/ddev-webserver:v1.23.0"
  },
  "cliLabels": {
    "com.ddev.site-name": "default"
  }
}
