{
  "id": "lando-php83",
  "name": "Lando PHP 8.3 / MariaDB 10.11",
  "destination": "Managed Lando images \u00b7 PHP 8.3 / MariaDB 10.11",
  "php": {
    "version": "8.3",
    "supportedPattern": "^8\\.[123]\\."
  },
  "database": {
    "type": "MariaDB",
    "version": "10.11",
    "supportedTypes": [
      "MariaDB",
      "MySQL"
    ],
    "supportedPattern": "^(?:10\\.(?:[3-9]|10|11)|11\\.|8\\.[0-9]+)"
  },
  "images": {
    "cli": "devwithlando/php:8.3-fpm-4",
    "db": "bitnami/mariadb:10.11",
    "web": "devwithlando/apache:2.4-4"
  },
  "cliLabels": {
    "io.lando.container": "TRUE"
  }
}
